{
  "protocol_version": "qf-v3-protocol-0.1",
  "schema_name": "MethodCard",
  "schema_version": "0.1.2",
  "method_card": {
    "method_id": "chunked_source_grounding_live_pilot_003_method",
    "lab_id": "chunked_source_grounding",
    "parent_question": "How can chunked/source-span LLM methods preserve source grounding while still supporting useful abstraction?",
    "method_family": "chunked_source_grounded_llm_reader_proposed",
    "intended_inputs": [
      "the same approved source excerpt used by long_context_judgment_live_pilot_001",
      "the same approved source hash used by chunked_source_grounding_live_pilot_002",
      "metadata-safe benchmark pack text_judgment_v0",
      "chunked source segments with tighter source-span support expectations",
      "DeepSeek V4 Pro with thinking disabled",
      "pre-recorded prompt and model configuration metadata"
    ],
    "intended_outputs": [
      "chunked_source_span_precision_proposal",
      "source-linked claim table",
      "tighter source-span support hints",
      "support hint precision labels",
      "unsupported-claim report",
      "brief method-failure notes"
    ],
    "known_risks": [
      "This is a proposed live LLM pilot planning record, not a completed run.",
      "Goal 7G found broad_segment_refs and limited_abstraction caveats in chunked_source_grounding_live_pilot_002.",
      "Tighter source-span hints may create false precision if broad support is not labeled honestly.",
      "The narrowed contract may preserve grounding while losing broader judgment abstraction.",
      "Prompt or trace handling may accidentally include raw source material if the privacy boundary is not followed."
    ],
    "non_goals": [
      "not a completed run",
      "not research evidence",
      "not a synthesis export",
      "not broader judgment abstraction notes",
      "not strategy validation",
      "not product authority",
      "not architecture or graduation evidence"
    ]
  }
}
