{
  "protocol_version": "qf-v3-protocol-0.1",
  "schema_name": "MethodCard",
  "schema_version": "0.1.2",
  "method_card": {
    "method_id": "llm_judge_calibration_live_pilot_001_method",
    "lab_id": "llm_judge_calibration",
    "parent_question": "Can an LLM judge reproduce operator-lineage review verdicts on existing live-pilot artifacts, and on which review axes?",
    "method_family": "blinded_llm_judge_agreement_study_proposed",
    "intended_inputs": [
      "eleven existing pilots' local output traces and their three previously approved source excerpts",
      "fifteen committed human evaluation records as ground truth (never shown to the judge)",
      "pre-registered blinding procedure, fixed 17-trial set, agreement metrics, and delegation thresholds",
      "mechanically extracted span text per locator candidate as judge input",
      "DeepSeek V4 Pro with thinking enabled and a reasoning-aware 8000-token cap",
      "pre-recorded prompt and model configuration metadata"
    ],
    "intended_outputs": [
      "judge_agreement_delegation_map_proposal",
      "per-axis agreement table (verdict, score, tags, locator labels)",
      "negative-control sycophancy results",
      "self-consistency probe results",
      "per-axis delegation labels: delegable, assistive, or not_delegable"
    ],
    "known_risks": [
      "This is a proposed live LLM pilot planning record, not a completed run.",
      "Verdict leakage through overlooked prompt content would invalidate trials; the harness asserts blinding before each call.",
      "The judge may pass negative controls (sycophancy), disqualifying axes from delegation.",
      "Fifteen ground-truth records is a small sample; results are provisional by construction.",
      "Judge and reviewed artifacts share a model family (DeepSeek V4), risking shared blind spots; recorded as a study limitation.",
      "Prompt traces contain source and artifact text and must stay in ignored local paths."
    ],
    "non_goals": [
      "not a completed run",
      "not research evidence",
      "not a synthesis export",
      "not review authority over any existing EvaluationRecord",
      "not a new protocol evaluator type",
      "not autonomous-loop activation",
      "not strategy validation",
      "not product authority",
      "not architecture or graduation evidence"
    ]
  }
}
